{
  "schemaVersion": "nexusengine.kits-lock.v1",
  "registries": [
    {
      "id": "LuminaryLabs-Dev/NexusEngine-Kits",
      "owner": "LuminaryLabs-Dev",
      "repository": "NexusEngine-Kits",
      "requestedRef": "main",
      "resolvedCommit": "36f736eccf8dd816563a23796ae4e1913495d0e2"
    }
  ],
  "selection": {
    "bundles": [
      "all"
    ]
  },
  "resolution": {
    "installOrder": [
      "ar-experience-kit",
      "ar-kit",
      "camera-collision-kit",
      "character-ragdoll-kit",
      "collectible-kit",
      "companion-command-kit",
      "generic-resource-loop-kit",
      "greybox-building-kit",
      "interaction-kit",
      "interaction-target-kit",
      "kit-registry-domain-kit",
      "light-combat-kit",
      "lock-and-socket-kit",
      "moving-target-kit",
      "objective-kit",
      "render-descriptor-kit",
      "reveal-light-kit",
      "seed-kit",
      "sorting-kit",
      "spatial-room-kit",
      "surface-placement-kit",
      "symbol-alignment-kit",
      "capability-graph-domain-kit",
      "composition-planning-domain-kit"
    ],
    "coreDependencies": [],
    "kits": [
      {
        "id": "ar-experience-kit",
        "version": "1.0.0",
        "registryId": "LuminaryLabs-Dev/NexusEngine-Kits",
        "resolvedCommit": "36f736eccf8dd816563a23796ae4e1913495d0e2",
        "integrity": "sha256-EreSUTTfZg0FEU3I91PBfXfaoEKRj2cyGOIpu0Q78RU=",
        "module": {
          "package": "./kits/migrated-gameplay/index.js",
          "node": "./kits/migrated-gameplay/index.js",
          "browser": "https://cdn.jsdelivr.net/gh/LuminaryLabs-Dev/NexusEngine-Kits@36f736eccf8dd816563a23796ae4e1913495d0e2/kits/migrated-gameplay/index.js"
        }
      },
      {
        "id": "ar-kit",
        "version": "1.0.0",
        "registryId": "LuminaryLabs-Dev/NexusEngine-Kits",
        "resolvedCommit": "36f736eccf8dd816563a23796ae4e1913495d0e2",
        "integrity": "sha256-EreSUTTfZg0FEU3I91PBfXfaoEKRj2cyGOIpu0Q78RU=",
        "module": {
          "package": "./kits/migrated-gameplay/index.js",
          "node": "./kits/migrated-gameplay/index.js",
          "browser": "https://cdn.jsdelivr.net/gh/LuminaryLabs-Dev/NexusEngine-Kits@36f736eccf8dd816563a23796ae4e1913495d0e2/kits/migrated-gameplay/index.js"
        }
      },
      {
        "id": "camera-collision-kit",
        "version": "1.0.0",
        "registryId": "LuminaryLabs-Dev/NexusEngine-Kits",
        "resolvedCommit": "36f736eccf8dd816563a23796ae4e1913495d0e2",
        "integrity": "sha256-EreSUTTfZg0FEU3I91PBfXfaoEKRj2cyGOIpu0Q78RU=",
        "module": {
          "package": "./kits/migrated-gameplay/index.js",
          "node": "./kits/migrated-gameplay/index.js",
          "browser": "https://cdn.jsdelivr.net/gh/LuminaryLabs-Dev/NexusEngine-Kits@36f736eccf8dd816563a23796ae4e1913495d0e2/kits/migrated-gameplay/index.js"
        }
      },
      {
        "id": "character-ragdoll-kit",
        "version": "1.0.0",
        "registryId": "LuminaryLabs-Dev/NexusEngine-Kits",
        "resolvedCommit": "36f736eccf8dd816563a23796ae4e1913495d0e2",
        "integrity": "sha256-EreSUTTfZg0FEU3I91PBfXfaoEKRj2cyGOIpu0Q78RU=",
        "module": {
          "package": "./kits/migrated-gameplay/index.js",
          "node": "./kits/migrated-gameplay/index.js",
          "browser": "https://cdn.jsdelivr.net/gh/LuminaryLabs-Dev/NexusEngine-Kits@36f736eccf8dd816563a23796ae4e1913495d0e2/kits/migrated-gameplay/index.js"
        }
      },
      {
        "id": "collectible-kit",
        "version": "1.0.0",
        "registryId": "LuminaryLabs-Dev/NexusEngine-Kits",
        "resolvedCommit": "36f736eccf8dd816563a23796ae4e1913495d0e2",
        "integrity": "sha256-EreSUTTfZg0FEU3I91PBfXfaoEKRj2cyGOIpu0Q78RU=",
        "module": {
          "package": "./kits/migrated-gameplay/index.js",
          "node": "./kits/migrated-gameplay/index.js",
          "browser": "https://cdn.jsdelivr.net/gh/LuminaryLabs-Dev/NexusEngine-Kits@36f736eccf8dd816563a23796ae4e1913495d0e2/kits/migrated-gameplay/index.js"
        }
      },
      {
        "id": "companion-command-kit",
        "version": "1.0.0",
        "registryId": "LuminaryLabs-Dev/NexusEngine-Kits",
        "resolvedCommit": "36f736eccf8dd816563a23796ae4e1913495d0e2",
        "integrity": "sha256-EreSUTTfZg0FEU3I91PBfXfaoEKRj2cyGOIpu0Q78RU=",
        "module": {
          "package": "./kits/migrated-gameplay/index.js",
          "node": "./kits/migrated-gameplay/index.js",
          "browser": "https://cdn.jsdelivr.net/gh/LuminaryLabs-Dev/NexusEngine-Kits@36f736eccf8dd816563a23796ae4e1913495d0e2/kits/migrated-gameplay/index.js"
        }
      },
      {
        "id": "generic-resource-loop-kit",
        "version": "1.0.0",
        "registryId": "LuminaryLabs-Dev/NexusEngine-Kits",
        "resolvedCommit": "36f736eccf8dd816563a23796ae4e1913495d0e2",
        "integrity": "sha256-uk6UGoKT3rY+8hm8nvJJ4CMdDVnZXP8Luuxt+SAuVgE=",
        "module": {
          "package": "./kits/simulation/generic-resource-loop-kit/index.js",
          "node": "./kits/simulation/generic-resource-loop-kit/index.js",
          "browser": "https://cdn.jsdelivr.net/gh/LuminaryLabs-Dev/NexusEngine-Kits@36f736eccf8dd816563a23796ae4e1913495d0e2/kits/simulation/generic-resource-loop-kit/index.js"
        }
      },
      {
        "id": "greybox-building-kit",
        "version": "1.0.0",
        "registryId": "LuminaryLabs-Dev/NexusEngine-Kits",
        "resolvedCommit": "36f736eccf8dd816563a23796ae4e1913495d0e2",
        "integrity": "sha256-EreSUTTfZg0FEU3I91PBfXfaoEKRj2cyGOIpu0Q78RU=",
        "module": {
          "package": "./kits/migrated-gameplay/index.js",
          "node": "./kits/migrated-gameplay/index.js",
          "browser": "https://cdn.jsdelivr.net/gh/LuminaryLabs-Dev/NexusEngine-Kits@36f736eccf8dd816563a23796ae4e1913495d0e2/kits/migrated-gameplay/index.js"
        }
      },
      {
        "id": "interaction-kit",
        "version": "1.0.0",
        "registryId": "LuminaryLabs-Dev/NexusEngine-Kits",
        "resolvedCommit": "36f736eccf8dd816563a23796ae4e1913495d0e2",
        "integrity": "sha256-EreSUTTfZg0FEU3I91PBfXfaoEKRj2cyGOIpu0Q78RU=",
        "module": {
          "package": "./kits/migrated-gameplay/index.js",
          "node": "./kits/migrated-gameplay/index.js",
          "browser": "https://cdn.jsdelivr.net/gh/LuminaryLabs-Dev/NexusEngine-Kits@36f736eccf8dd816563a23796ae4e1913495d0e2/kits/migrated-gameplay/index.js"
        }
      },
      {
        "id": "interaction-target-kit",
        "version": "1.0.0",
        "registryId": "LuminaryLabs-Dev/NexusEngine-Kits",
        "resolvedCommit": "36f736eccf8dd816563a23796ae4e1913495d0e2",
        "integrity": "sha256-EreSUTTfZg0FEU3I91PBfXfaoEKRj2cyGOIpu0Q78RU=",
        "module": {
          "package": "./kits/migrated-gameplay/index.js",
          "node": "./kits/migrated-gameplay/index.js",
          "browser": "https://cdn.jsdelivr.net/gh/LuminaryLabs-Dev/NexusEngine-Kits@36f736eccf8dd816563a23796ae4e1913495d0e2/kits/migrated-gameplay/index.js"
        }
      },
      {
        "id": "kit-registry-domain-kit",
        "version": "1.0.0",
        "registryId": "LuminaryLabs-Dev/NexusEngine-Kits",
        "resolvedCommit": "36f736eccf8dd816563a23796ae4e1913495d0e2",
        "integrity": "sha256-xyu8d8rRV9mBtXNTMrLoEl14EhPPWC6qqzy4oKDBq1w=",
        "module": {
          "package": "./kits/registry/kit-registry-domain-kit/index.js",
          "node": "./kits/registry/kit-registry-domain-kit/index.js",
          "browser": "https://cdn.jsdelivr.net/gh/LuminaryLabs-Dev/NexusEngine-Kits@36f736eccf8dd816563a23796ae4e1913495d0e2/kits/registry/kit-registry-domain-kit/index.js"
        }
      },
      {
        "id": "light-combat-kit",
        "version": "1.0.0",
        "registryId": "LuminaryLabs-Dev/NexusEngine-Kits",
        "resolvedCommit": "36f736eccf8dd816563a23796ae4e1913495d0e2",
        "integrity": "sha256-EreSUTTfZg0FEU3I91PBfXfaoEKRj2cyGOIpu0Q78RU=",
        "module": {
          "package": "./kits/migrated-gameplay/index.js",
          "node": "./kits/migrated-gameplay/index.js",
          "browser": "https://cdn.jsdelivr.net/gh/LuminaryLabs-Dev/NexusEngine-Kits@36f736eccf8dd816563a23796ae4e1913495d0e2/kits/migrated-gameplay/index.js"
        }
      },
      {
        "id": "lock-and-socket-kit",
        "version": "1.0.0",
        "registryId": "LuminaryLabs-Dev/NexusEngine-Kits",
        "resolvedCommit": "36f736eccf8dd816563a23796ae4e1913495d0e2",
        "integrity": "sha256-EreSUTTfZg0FEU3I91PBfXfaoEKRj2cyGOIpu0Q78RU=",
        "module": {
          "package": "./kits/migrated-gameplay/index.js",
          "node": "./kits/migrated-gameplay/index.js",
          "browser": "https://cdn.jsdelivr.net/gh/LuminaryLabs-Dev/NexusEngine-Kits@36f736eccf8dd816563a23796ae4e1913495d0e2/kits/migrated-gameplay/index.js"
        }
      },
      {
        "id": "moving-target-kit",
        "version": "1.0.0",
        "registryId": "LuminaryLabs-Dev/NexusEngine-Kits",
        "resolvedCommit": "36f736eccf8dd816563a23796ae4e1913495d0e2",
        "integrity": "sha256-EreSUTTfZg0FEU3I91PBfXfaoEKRj2cyGOIpu0Q78RU=",
        "module": {
          "package": "./kits/migrated-gameplay/index.js",
          "node": "./kits/migrated-gameplay/index.js",
          "browser": "https://cdn.jsdelivr.net/gh/LuminaryLabs-Dev/NexusEngine-Kits@36f736eccf8dd816563a23796ae4e1913495d0e2/kits/migrated-gameplay/index.js"
        }
      },
      {
        "id": "objective-kit",
        "version": "1.0.0",
        "registryId": "LuminaryLabs-Dev/NexusEngine-Kits",
        "resolvedCommit": "36f736eccf8dd816563a23796ae4e1913495d0e2",
        "integrity": "sha256-EreSUTTfZg0FEU3I91PBfXfaoEKRj2cyGOIpu0Q78RU=",
        "module": {
          "package": "./kits/migrated-gameplay/index.js",
          "node": "./kits/migrated-gameplay/index.js",